{"schema_version":"1.0.0","kind":"ProviderQualificationArtifact","qualification_id":"qual_fixture_ast","authority_ref":"authority_fixture_qualification_lab","qualified_by":"fixture-qualification-lab","authority_tier":"qualified_ast_for_declared_scope","capability_id":"change-safety","provider_id":"fixture-ast","provider_version":"1.0","provider_artifact_content_id":"sha256:5555555555555555555555555555555555555555555555555555555555555555","trust_domain_id":"fixture-ast-implementation","decision_ref":"pad_fixture_ast","result":"QUALIFIED"}
