{"schema_version":"1.0.0","kind":"ProviderQualificationArtifact","qualification_id":"qual_fixture_parser","authority_ref":"authority_fixture_qualification_lab","qualified_by":"fixture-qualification-lab","authority_tier":"qualified_parser_for_declared_scope","capability_id":"windows-static-precheck","provider_id":"fixture-parser","provider_version":"1.0","provider_artifact_content_id":"sha256:1111111111111111111111111111111111111111111111111111111111111111","trust_domain_id":"fixture-parser-implementation","decision_ref":"pad_fixture_parser","result":"QUALIFIED"}
